{
  "id": "banner_reveal",
  "schemaVersion": "2.0.0",
  "state": "banner",
  "priority": 50,
  "duration": 6.0,
  "loop": false,
  "loopCount": 1,
  "globalModifiers": {
    "intensity": 1.4,
    "speed": 0.7
  },
  "blending": {
    "blendInDuration": 1.0,
    "blendOutDuration": 1.5,
    "blendCurve": "ease_in_out"
  },
  "parameters": {
    "ParamBreath": {
      "enabled": true,
      "amplitude": 0.45,
      "frequency": 0.2,
      "phase": 0,
      "waveform": "sine",
      "easing": "ease_in_out",
      "baseValue": 0.0,
      "minClamp": -0.6,
      "maxClamp": 0.6
    },
    "ParamBodyAngleX": {
      "enabled": true,
      "amplitude": 0.12,
      "frequency": 0.15,
      "phase": 0,
      "waveform": "sine",
      "easing": "ease_out",
      "baseValue": 0.0,
      "minClamp": -0.35,
      "maxClamp": 0.35
    },
    "ParamBodyAngleY": {
      "enabled": true,
      "amplitude": 0.08,
      "frequency": 0.12,
      "phase": 1.57,
      "waveform": "sine",
      "easing": "ease_in_out",
      "baseValue": 0.1,
      "minClamp": -0.25,
      "maxClamp": 0.35
    },
    "ParamBodyAngleZ": {
      "enabled": true,
      "amplitude": 0.06,
      "frequency": 0.1,
      "phase": 0,
      "waveform": "sine",
      "easing": "ease_out",
      "baseValue": -0.03,
      "minClamp": -0.15,
      "maxClamp": 0.15
    },
    "ParamAngleX": {
      "enabled": true,
      "amplitude": 0.05,
      "frequency": 0.08,
      "phase": 0,
      "waveform": "sine",
      "easing": "ease_in_out",
      "baseValue": 0.0,
      "minClamp": -0.2,
      "maxClamp": 0.2
    },
    "ParamAngleY": {
      "enabled": true,
      "amplitude": 0.04,
      "frequency": 0.06,
      "phase": 1.0,
      "waveform": "sine",
      "easing": "ease_out",
      "baseValue": 0.05,
      "minClamp": -0.15,
      "maxClamp": 0.2
    },
    "ParamEyeLOpen": {
      "enabled": true,
      "amplitude": 0.0,
      "frequency": 0.05,
      "phase": 0,
      "waveform": "sine",
      "easing": "linear",
      "baseValue": 1.0,
      "minClamp": 0.95,
      "maxClamp": 1.0
    },
    "ParamEyeROpen": {
      "enabled": true,
      "amplitude": 0.0,
      "frequency": 0.05,
      "phase": 0,
      "waveform": "sine",
      "easing": "linear",
      "baseValue": 1.0,
      "minClamp": 0.95,
      "maxClamp": 1.0
    },
    "ParamEyeBallX": {
      "enabled": true,
      "amplitude": 0.08,
      "frequency": 0.08,
      "phase": 0,
      "waveform": "sine",
      "easing": "ease_in_out",
      "baseValue": 0.0,
      "minClamp": -0.4,
      "maxClamp": 0.4
    },
    "ParamMouthForm": {
      "enabled": true,
      "amplitude": 0.15,
      "frequency": 0.05,
      "phase": 0,
      "waveform": "sine",
      "easing": "ease_out",
      "baseValue": 0.25,
      "minClamp": 0.0,
      "maxClamp": 0.5
    },
    "ParamHairFront": {
      "enabled": true,
      "amplitude": 0.18,
      "frequency": 0.25,
      "phase": 0,
      "waveform": "sine",
      "easing": "ease_out",
      "baseValue": 0.0,
      "minClamp": -0.45,
      "maxClamp": 0.45
    },
    "ParamHairSide": {
      "enabled": true,
      "amplitude": 0.14,
      "frequency": 0.22,
      "phase": 0.5,
      "waveform": "sine",
      "easing": "ease_out",
      "baseValue": 0.0,
      "minClamp": -0.45,
      "maxClamp": 0.45
    },
    "ParamHairBack": {
      "enabled": true,
      "amplitude": 0.16,
      "frequency": 0.18,
      "phase": 1.0,
      "waveform": "sine",
      "easing": "ease_out",
      "baseValue": 0.0,
      "minClamp": -0.45,
      "maxClamp": 0.45
    }
  },
  "ratingClamps": {
    "ParamBustX": { "min": -0.25, "max": 0.25 },
    "ParamBustY": { "min": -0.25, "max": 0.25 },
    "ParamBaseX": { "min": -0.3, "max": 0.3 },
    "ParamBaseY": { "min": -0.2, "max": 0.2 }
  },
  "metadata": {
    "author": "DivineHeros Team",
    "created": "2025-01-08T00:00:00Z",
    "description": "Dramatic banner reveal with slow, elegant motion. Non-looping presentation sequence.",
    "tags": ["banner", "reveal", "summon", "dramatic", "non-loop"]
  }
}